id,title,selftext,score,created_utc,full_text,label
doqwow,"Our most-broken and least-understood rules is ""helpers may not invite private contact as a first resort"", so we've made a new wiki to explain it","We understand that most people who reply immediately to an OP with an invitation to talk privately  mean only to help, but this type of response usually leads to either disappointment or disaster.  it usually works out quite differently here than when you say ""PM me anytime"" in a casual social context.  

We have huge admiration and appreciation for the goodwill and good citizenship of so many of you who support others here and flag inappropriate content - even more so because we know that so many of you are struggling yourselves.  We're hard at work behind the scenes on more information and resources to make it easier to give and get quality help here - this is just a small start.  

Our new wiki page explains in detail why it's much better to respond in public comments, at least until you've gotten to know someone.  It will be maintained at /r/depression/wiki/private_contact, and the full text of the current version is below.

*****

###Summary###

**Anyone who, while acting as a helper, invites or accepts private contact (I.e. PMs, chat, or any kind of offsite communication) early in the conversion is showing either bad intentions or bad judgement.  Either way, it's unwise to trust them.** 


""PM me anytime"" seems like a kind and generous offer. And it might be perfectly well-meaning, but, unless and until a solid rapport has been established, it's just not a wise idea.  Here are some points to consider before you offer or accept an invitation to communicate privately.

* **By posting supportive replies publicly, you'll help more people than just the OP. If your responses are of good quality, you'll educate and inspire other helpers.** [The 1-9-90 rule](https://en.wikipedia.org/wiki/1%25_rule_(Internet_culture\)) applies here as much as it does anywhere else on the internet.  

* People who are struggling with serious mental-health issues often (justifiably) have a low tolerance for disappointment and a high-level of ever-changing emotional need. **Unless the helper is able to make a 100% commitment to be there for them in every way, for as long as necessary, offering a personal inbox as a resource is likely to do more harm than good.** This is why mental-health crisis-line responders usually don't give their names and callers aren't allowed to request specific responders.  It's much healthier and safer for the callers to develop a relationship with the agency as a whole.  Analogously, it's much safer and healthier for our OPs to develop a relationship with the community as a whole.  Even trained responders are generally not allowed to work high-intensity situations alone.  It's partly about availability, but it's mostly about wider perspective and preventing compassion fatigue. 

* **If a helper gets in over their head with someone whose mental-health issues (including suicidality, which is often comorbid with depression) escalate, in a PM conversation it's much harder for others, including the /r/depression and /r/SuicideWatch moderators to help**.  (Contrary to common assumptions, moderators can't see or police PMs.)  

* In our observation over many years, the people who say ""PM me"" the most are consistently the ones with the least understanding of mental-health issues and mental-health support. We all have gaps in our knowledge and in our ability to communicate effectively.  Community input mitigates these limitations. **There's no reason why someone who's truly here to help would want to hide their responses from community scrutiny**.  If helpers are concerned about their own privacy, keep in mind that self-disclosure, when used supportively, is more about the feelings than the details, and that we have no problem here with the use of alt/throwaway accounts, and have no restrictions on account age or karma.  

*  We all know the internet is used by some people to exploit or abuse others.  These people *do* want to hide their deceptive and manipulative responses from everyone except their victims. There are many of them who specifically target those who are vulnerable because of mental-health issues. **If a helper invites an OP to talk privately and gives them a good, supportive experience, they've primed that person to be more vulnerable to abusers.** This sort of cognitive priming tends to be particularly effective when someone's in a state of mental-health crisis, when people rely more on heuristics than critical reasoning.

* If OPs want to talk privately, posting on a wide-open anonymous forum like reddit might not be the best option. Although we don't recommend it, we do allow OPs to request private contact when asking for support. If you want to do this, please keep your expectations realistic, and to have a careful look at the history of anyone who offers to PM before opening up to them.",2366,1572360722.0,"Our most-broken and least-understood rules is ""helpers may not invite private contact as a first resort"", so we've made a new wiki to explain it We understand that most people who reply immediately to an OP with an invitation to talk privately  mean only to help, but this type of response usually leads to either disappointment or disaster.  it usually works out quite differently here than when you say ""PM me anytime"" in a casual social context.  

We have huge admiration and appreciation for the goodwill and good citizenship of so many of you who support others here and flag inappropriate content - even more so because we know that so many of you are struggling yourselves.  We're hard at work behind the scenes on more information and resources to make it easier to give and get quality help here - this is just a small start.  

Our new wiki page explains in detail why it's much better to respond in public comments, at least until you've gotten to know someone.  It will be maintained at /r/depression/wiki/private_contact, and the full text of the current version is below.

*****

###Summary###

**Anyone who, while acting as a helper, invites or accepts private contact (I.e. PMs, chat, or any kind of offsite communication) early in the conversion is showing either bad intentions or bad judgement.  Either way, it's unwise to trust them.** 


""PM me anytime"" seems like a kind and generous offer. And it might be perfectly well-meaning, but, unless and until a solid rapport has been established, it's just not a wise idea.  Here are some points to consider before you offer or accept an invitation to communicate privately.

* **By posting supportive replies publicly, you'll help more people than just the OP. If your responses are of good quality, you'll educate and inspire other helpers.** [The 1-9-90 rule](https://en.wikipedia.org/wiki/1%25_rule_(Internet_culture\)) applies here as much as it does anywhere else on the internet.  

* People who are struggling with serious mental-health issues often (justifiably) have a low tolerance for disappointment and a high-level of ever-changing emotional need. **Unless the helper is able to make a 100% commitment to be there for them in every way, for as long as necessary,",neutral
1frqlk0,"Regular check-in post, with information about our rules and wikis","Welcome to /r/depression's check-in post - a place to take a moment and share what is going on and how you are doing. If you have an accomplishment you want to talk about (these shouldn't be standalone posts in the sub as they violate the ""role model"" rule, but are permitted here), or are having a tough time but prefer not to make your own post, this is a place you can share.

-----

Our subreddit rules are located in the sidebar (you can also always access them at https://www.reddit.com/r/depression/about/rules) - since all of them exist for important safety reasons, we ask everyone here to read and follow them. Please click 'report' on any harmful content you see here - we always want to know and deal as soon as we can.

We also have several wikis there for help with finding and giving support:

https://www.reddit.com/r/depression/wiki/what_is_depression provides guidance about what is and isn't a depressive disorder, guidance on the complex nature of the illnesses that are usually grouped under the ""depression"" label, and redirect information for common off-topic issues.

https://www.reddit.com/r/depression/wiki/giving_help offers information on the nature and value of peer support for mental-health issues in general, and lots of guidance for learning what is -- and isn't -- usually helpful in giving peer support.

YSK that the types of rule violations that we most frequently see interfering with people getting safe and relevant support here are:

- People breaking the private contact rule. You should never trust anyone who tries to get you into a private conversation in response to a post here. See https://www.reddit.com/r/depression/wiki/private_contact

- ""I'm here to help"" posts. This shows that you don't understand the most basic principles of peer support, especially selectivity. The ""giving help"" wiki explains more about this.

- Role modelling, i.e. ""achievement"" or ""advice"" posts. This is an expert-free zone -- that's what peer support means (rule 5). We know that ""internet culture"" celebrate not just bragging about your achievements but bragging about your good intentions. Nothing like that is ever acceptable here.

- Content that's more about 'making a statement' or casually polling the sub than seeking personal support (or, in a comment, giving it) (rules 1, 2 and 10).

- Off-topic posts about difficult situations or circumstances, including interpersonal losses. Grief, sadness, anger, and other difficult emotions are not mental illnesses. The ""what is depression"" wiki has suggestions for other places to post about these issues, which are 100% valid and serious but inappropriate here.",43,1727564743.0,"Regular check-in post, with information about our rules and wikis Welcome to /r/depression's check-in post - a place to take a moment and share what is going on and how you are doing. If you have an accomplishment you want to talk about (these shouldn't be standalone posts in the sub as they violate the ""role model"" rule, but are permitted here), or are having a tough time but prefer not to make your own post, this is a place you can share.

-----

Our subreddit rules are located in the sidebar (you can also always access them at https://www.reddit.com/r/depression/about/rules) - since all of them exist for important safety reasons, we ask everyone here to read and follow them. Please click 'report' on any harmful content you see here - we always want to know and deal as soon as we can.

We also have several wikis there for help with finding and giving support:

https://www.reddit.com/r/depression/wiki/what_is_depression provides guidance about what is and isn't a depressive disorder, guidance on the complex nature of the illnesses that are usually grouped under the ""depression"" label, and redirect information for common off-topic issues.

https://www.reddit.com/r/depression/wiki/giving_help offers information on the nature and value of peer support for mental-health issues in general, and lots of guidance for learning what is -- and isn't -- usually helpful in giving peer support.

YSK that the types of rule violations that we most frequently see interfering with people getting safe and relevant support here are:

- People breaking the private contact rule. You should never trust anyone who tries to get you into a private conversation in response to a post here. See https://www.reddit.com/r/depression/wiki/private_contact

- ""I'm here to help"" posts. This shows that you don't understand the most basic principles of peer support, especially selectivity. The ""giving help"" wiki explains more about this.

- Role modelling, i.e. ""achievement"" or ""advice"" posts. This is an expert-free zone -- that's what peer support means (rule 5). We know that ""internet culture"" celebrate not just bragging about your achievements but bragging about your good intentions. Nothing like that",neutral
1jkkpcp,“God will get you through this.”,"Yeah, well your god had done nothing but hurt me. Your god has done nothing but make my life a living hell. I’ve tried trusting your god for 28 years and he failed me. 

You trust your god. Don’t give me a false sense of hope because I don’t have anymore left in me. 

(I’m sorry for the harshness. I just needed to let it out. I spend so much time and effort to convince people that there’s hope but am completely defeated and don’t have much more to give for myself or anyone else.)",89,1743018213.0,"“God will get you through this.” Yeah, well your god had done nothing but hurt me. Your god has done nothing but make my life a living hell. I’ve tried trusting your god for 28 years and he failed me. 

You trust your god. Don’t give me a false sense of hope because I don’t have anymore left in me. 

(I’m sorry for the harshness. I just needed to let it out. I spend so much time and effort to convince people that there’s hope but am completely defeated and don’t have much more to give for myself or anyone else.)",negative
1jkekpb,I cut myself many times on the wrist this morning. It’s bleeding a lot more serious than I expected. I have no person in real life that I can talk to. Please someone talk to me if you can spare a minute. Thanks,I’m really really desperate right now. I don’t know what to do. ,108,1743003171.0,I cut myself many times on the wrist this morning. It’s bleeding a lot more serious than I expected. I have no person in real life that I can talk to. Please someone talk to me if you can spare a minute. Thanks I’m really really desperate right now. I don’t know what to do. ,negative
1jkmuex,I just want to die without hurting my parents,"I'm so sick of the loneliness I feel. Everyone keeps abandon me. No one is scared of losing me. I feel so empty, I don't have anyone to talk. All my friends are busy, they have works, family, they have successful lifes and they don't have time for my shit. I mean, I don't want to bother them with my stupid garbage. It's just I don't have anything anymore. No money, no job, no love. I just want to die. My parents would be so sad about my death so that's why I keep living. But honestly, if I could die without hurting them, that would be the best thing ever. ",26,1743023517.0,"I just want to die without hurting my parents I'm so sick of the loneliness I feel. Everyone keeps abandon me. No one is scared of losing me. I feel so empty, I don't have anyone to talk. All my friends are busy, they have works, family, they have successful lifes and they don't have time for my shit. I mean, I don't want to bother them with my stupid garbage. It's just I don't have anything anymore. No money, no job, no love. I just want to die. My parents would be so sad about my death so that's why I keep living. But honestly, if I could die without hurting them, that would be the best thing ever. ",negative
1jkhvyk,Humans are one of the worst creatures,"I work as a peer supporter. I received a person on the spot with no preparation given, no history given, no papers given. This was in December. Today we started working on her housing application. Her mother was yelling at me because we only just started. How is it my fault that I wasn't given jack-fucking-shit and just was supposed to pick up the slack someone else didn't want to do because the participant is handicapped?

Another person missed their housing interview because I was sent an email about the interview the night before at 7 fucking pm. I stop working at 3pm. I'm told to turn off my phone when I'm off work because I need to separate myself from my work when I am off work hours. Participant missed their housing interview. God knows when the next one is. 

I just want to fucking cry. This woman was yelling and sent me back to the lashings I took when I was a child. 5 years of therapy. Down the fucking drain. Tomorrow I have to go to a men's shelter that is known for people doing drugs in the open. The guy doesn't want to leave his room. What the fuck am I supposed to do to protect myself and also be a peer for someone? ",43,1743011300.0,"Humans are one of the worst creatures I work as a peer supporter. I received a person on the spot with no preparation given, no history given, no papers given. This was in December. Today we started working on her housing application. Her mother was yelling at me because we only just started. How is it my fault that I wasn't given jack-fucking-shit and just was supposed to pick up the slack someone else didn't want to do because the participant is handicapped?

Another person missed their housing interview because I was sent an email about the interview the night before at 7 fucking pm. I stop working at 3pm. I'm told to turn off my phone when I'm off work because I need to separate myself from my work when I am off work hours. Participant missed their housing interview. God knows when the next one is. 

I just want to fucking cry. This woman was yelling and sent me back to the lashings I took when I was a child. 5 years of therapy. Down the fucking drain. Tomorrow I have to go to a men's shelter that is known for people doing drugs in the open. The guy doesn't want to leave his room. What the fuck am I supposed to do to protect myself and also be a peer for someone? ",negative
1jkgdw3,Is it ok to use escapism to cope with depression?,"I really don't like myself or my life at all and I've been using all sorts of activities to make myself feel good in the moment all the while escaping myself. I used to get bullied for being (potentially) neurodivergent, short and ugly by peers in school and sometimes even by some of my teachers. 

Going home I would play video games, watch anime and listen to music and later in high school I got into playing guitar and making digital art. You could say I'm a creative person but my therapist said I just started using all those activities to forget about myself like a way to distract myself from my situation.

I'm really just using these activities to make myself feel good as if I'd be special or unique but the reality is I'm just an ugly, short, balding unlovable weirdo. I guess I can have my peace of mind going home from my boring day job and feel good in the moment by playing a game, drawing something I think looks cool or playing a cool song, it's not hurting anyone after all.",24,1743007678.0,"Is it ok to use escapism to cope with depression? I really don't like myself or my life at all and I've been using all sorts of activities to make myself feel good in the moment all the while escaping myself. I used to get bullied for being (potentially) neurodivergent, short and ugly by peers in school and sometimes even by some of my teachers. 

Going home I would play video games, watch anime and listen to music and later in high school I got into playing guitar and making digital art. You could say I'm a creative person but my therapist said I just started using all those activities to forget about myself like a way to distract myself from my situation.

I'm really just using these activities to make myself feel good as if I'd be special or unique but the reality is I'm just an ugly, short, balding unlovable weirdo. I guess I can have my peace of mind going home from my boring day job and feel good in the moment by playing a game, drawing something I think looks cool or playing a cool song, it's not hurting anyone after all.",neutral
1jkfz8c,"Life finally broke me, depression ftw","The last 2 years has been rough, had a house fire, lost everything, worked a lot of doubles while couch surfing to regain everything, met a girl, she was abusive & controlling, isolated me from everyone, so I now have no friends, she cheated on me & stole everything out of my apartment, police did nothing. Lost my job because of her, I moved in with my grandfather not long after and started trying to rebuild my life. 

Everything was going alright until, a few days ago, we were out grocery shopping. While I was paying for the groceries, my Gramps walked out of the store to sit on the bench outside to wait for me because he had breathing problems and couldn't stand for long periods of time. As I came out of the store, I saw him getting attacked and robbed by a group of guys I don't remember how many. All I remember in that moment is just rushing in, no matter how many times I got knocked down I quickly stood up and shielded him from every attack. I probably could've taken out some of them if I fought back but I didn't want to risk moving from my position and my grandfather getting hurt so I just tanked the hits. Someone called the police and the attackers took off. I ended up blacking out for a bit, woke up with a broken nose, a few fractures in my face & news that the whole situation caused my grandfather to have a heart attack and die. 

My fractures were a little more severe than the doctor originally thought, so I was rushed to the trauma unit in another city almost an hour away because the hospital in my town is a none surgical hospital. Been here a few days. A police report was made and they're looking for the suspects. I have no faith in the police. Early this morning I got a call from my boss saying I'm fired. Even though I explained what happened, he didn't seem to care. Now I'm in the hospital healing, about to be homeless when I get out. Idk how long an enviction notice gives me but it'll be like a week or less until rent is due again and I'm trying to get discharged early to hopefully get bacl to my grandfather's apartment to grab what little clothes and stuff I have left and try to figure out my next move. With less than 36 and change to my name, no vehicle, no family, no friends and yhe coroner keeps asking what I want to do with the body, what funeral home, and all that sort of stuff. He didn't have life insurance, or a will, or anything in savings.

 I keep saying idk because I don't know because I just dont. I don't understand how to handle this, I never had to handle this. I feel stupid. Everyone expects me to have this whole situation magically under control, but I don't, I feel like a child. I'm so lost, I'm on my own. I understand I'm an adult, and I should just man up & just deal with it. But I'm so emotionally numb right now. I try so hard to be a good person. I just don't understand why bad things keep happening. I can't seem to catch a break. I feel so broken that I can't even bring myself to cry over my grandfather's death for some reason. Does that make me a horrible person?  I know I should be freaking out about my financial situations and what's going to happen to me after I leave the hospital, but I'm oddly calm, and idk why. I apologize for the long post, I don't expect anyone to care or to even read all of this. I just needed to get my feelings out because there's no one else I can talk to rn.

TLDR: House fire, abusive relationship, lost everything twice, grandfather attacked, I was hurt defending him, and now facing financial hardships, life sucks.",21,1743006658.0,"Life finally broke me, depression ftw The last 2 years has been rough, had a house fire, lost everything, worked a lot of doubles while couch surfing to regain everything, met a girl, she was abusive & controlling, isolated me from everyone, so I now have no friends, she cheated on me & stole everything out of my apartment, police did nothing. Lost my job because of her, I moved in with my grandfather not long after and started trying to rebuild my life. 

Everything was going alright until, a few days ago, we were out grocery shopping. While I was paying for the groceries, my Gramps walked out of the store to sit on the bench outside to wait for me because he had breathing problems and couldn't stand for long periods of time. As I came out of the store, I saw him getting attacked and robbed by a group of guys I don't remember how many. All I remember in that moment is just rushing in, no matter how many times I got knocked down I quickly stood up and shielded him from every attack. I probably could've taken out some of them if I fought back but I didn't want to risk moving from my position and my grandfather getting hurt so I just tanked the hits. Someone called the police and the attackers took off. I ended up blacking out for a bit, woke up with a broken nose, a few fractures in my face & news that the whole situation caused my grandfather to have a heart attack and die. 

My fractures were a little more severe than the doctor originally thought, so I was rushed to the trauma unit in another city almost an hour away because the hospital in my town is a none surgical hospital. Been here a few days. A police report was made and they're looking for the suspects. I have no faith in the police. Early this morning I got a call from my boss saying I'm fired. Even though I explained what happened, he didn't seem to care. Now I'm in the hospital healing, about to be homeless when I get out. Idk how long an enviction notice gives me but it'll be like a week or less until rent is due again and I'm trying to get discharged early to hopefully get bacl to my grandfather's apartment to grab what little clothes and stuff I have left and try to figure out my next move. With less than 36 and change to my name, no vehicle, no family, no friends and yhe coroner keeps asking what I want to do",negative
