id,title,selftext,score,created_utc,full_text,label
1jkqdms,Fighting A War In My Mind,"I grew up with the most violent and poor environment. I had never talked to a professional about anything that has happened and now I’m 20 and I feel like I’m doing absolutely nothing important in my life. I wake up, lay in bed, I manage to eat my meals but I can never escape my thoughts running all of the time. It’s like I am degrading myself, and I’ve tried everything in trying to ask somebody for help- and I know at my big age I should be able to do that on my own, but my mom would always dismiss my feelings of anxiety and tell me just to suck it up. I am the most anxious I’ve ever been and I can’t stop. I would never take my own life, but there has been multiple times I have thought about it. I just don’t know what do to. I don’t have money for therapy- I don’t have a car, and I don’t even have health insurance at the moment. It feels like everything has gone to shit and that sits very heavy on my heart. ",2,1743032732.0,"Fighting A War In My Mind I grew up with the most violent and poor environment. I had never talked to a professional about anything that has happened and now I’m 20 and I feel like I’m doing absolutely nothing important in my life. I wake up, lay in bed, I manage to eat my meals but I can never escape my thoughts running all of the time. It’s like I am degrading myself, and I’ve tried everything in trying to ask somebody for help- and I know at my big age I should be able to do that on my own, but my mom would always dismiss my feelings of anxiety and tell me just to suck it up. I am the most anxious I’ve ever been and I can’t stop. I would never take my own life, but there has been multiple times I have thought about it. I just don’t know what do to. I don’t have money for therapy- I don’t have a car, and I don’t even have health insurance at the moment. It feels like everything has gone to shit and that sits very heavy on my heart. ",negative
1jkkxu0,My bed is my only happiness,I’m only happy in bed right now I called out of work twice this week so I can stay in my room with the lights off in bed. My bed is my comfort and my happiness I eat fast food in bed and lay in bed all day long I know I’m putting weight on but I want to eat to cope with my depression and just lay naked in bed all day long. ,4,1743018797.0,My bed is my only happiness I’m only happy in bed right now I called out of work twice this week so I can stay in my room with the lights off in bed. My bed is my comfort and my happiness I eat fast food in bed and lay in bed all day long I know I’m putting weight on but I want to eat to cope with my depression and just lay naked in bed all day long. ,positive
1jkq68r,Otc antidepressent,I didnt take antidepressants when i got offered it because my dad said i shouldnt take the pills. Now i realized if i had taken the pills i would have enjoyed things. Now i have lost interest in everything i have no motivation to do things long term. I dont have any thing i enjoy doing. Its been like this for many years. I just cant do things long term. I want to tell my doctor and psychiatrist nurse but i think its not a good exuse. Is there an over the counter antidepressants that i can take?,2,1743032181.0,Otc antidepressent I didnt take antidepressants when i got offered it because my dad said i shouldnt take the pills. Now i realized if i had taken the pills i would have enjoyed things. Now i have lost interest in everything i have no motivation to do things long term. I dont have any thing i enjoy doing. Its been like this for many years. I just cant do things long term. I want to tell my doctor and psychiatrist nurse but i think its not a good exuse. Is there an over the counter antidepressants that i can take?,negative
1jkmzhu,Is my life salvageable?,"So I'm 25M (26 in a few days) and I think I fucked up my life. I've had a not very pleasant life, dealing with suicidal thoughts since I was 13 and depression since I was 17 (last year of high school). I manage to graduate from high school, but after that it went downhill. Did 2 years of college, but I had to stop because I was getting burned out, and I had to miss 2 weeks of classes because of a medical emergency and after that did not have the motivation to catch up.

After that I had one year of doing nothing at home waiting for another college to start. I had therapy twice a week to try and get better, but it didn't work. So I started my second college depressed, it was hard but ok, I even managed to make some friend and continued going to therapy, I tried so hard to get better, but I struggle to do all the coursework. In my third year I felt depression creeping up over me even harder, I stopped seeing my college friends and stopped doing my coursework, so I had to leave.

Two years has passed since. I never talked to my college friends again and never told them I failed. I never told my other friends I failed. I either stopped talking to them or lied to them because I'm too ashamed. I spent these two years as a NEET (I never left my mom's house) but I didn't give up, and I kept going to therapy and do some activities, like board game nights, hobbies etc. but i still feel terrible. I struggle more to do these activities and I spend my day on youtube, reddit or playing video games while sometimes practicing my other hobbies, but I often don't have the motivation.

Since last month, it's gotten worse, I don't want to do anything, I hate that I failed college and I miss my friends, I hate that I lied to them. I tried so many times to heal, but the depression never went away. Now I'm a 25yo with no education, no job, no experience, no drive, no skills and no talents

Is my life still salvageable?",3,1743023871.0,"Is my life salvageable? So I'm 25M (26 in a few days) and I think I fucked up my life. I've had a not very pleasant life, dealing with suicidal thoughts since I was 13 and depression since I was 17 (last year of high school). I manage to graduate from high school, but after that it went downhill. Did 2 years of college, but I had to stop because I was getting burned out, and I had to miss 2 weeks of classes because of a medical emergency and after that did not have the motivation to catch up.

After that I had one year of doing nothing at home waiting for another college to start. I had therapy twice a week to try and get better, but it didn't work. So I started my second college depressed, it was hard but ok, I even managed to make some friend and continued going to therapy, I tried so hard to get better, but I struggle to do all the coursework. In my third year I felt depression creeping up over me even harder, I stopped seeing my college friends and stopped doing my coursework, so I had to leave.

Two years has passed since. I never talked to my college friends again and never told them I failed. I never told my other friends I failed. I either stopped talking to them or lied to them because I'm too ashamed. I spent these two years as a NEET (I never left my mom's house) but I didn't give up, and I kept going to therapy and do some activities, like board game nights, hobbies etc. but i still feel terrible. I struggle more to do these activities and I spend my day on youtube, reddit or playing video games while sometimes practicing my other hobbies, but I often don't have the motivation.

Since last month, it's gotten worse, I don't want to do anything, I hate that I failed college and I miss my friends, I hate that I lied to them. I tried so many times to heal, but the depression never went away. Now I'm a 25yo with no education, no job, no experience, no drive, no skills and no talents

Is my life still salvageable?",negative
1jkpwvu,5 things that anxiety wants you to forget (but I came to remind you),"1. You've overcome difficult times before!

2. You don't need to believe all your thoughts!

3. Making mistakes does not mean failing!

4. People aren't judging you as much as you think!

5. Now is always more real than any fear of the future!


Did you need to read any of these now?",2,1743031491.0,"5 things that anxiety wants you to forget (but I came to remind you) 1. You've overcome difficult times before!

2. You don't need to believe all your thoughts!

3. Making mistakes does not mean failing!

4. People aren't judging you as much as you think!

5. Now is always more real than any fear of the future!


Did you need to read any of these now?",positive
1jkpvqs,"I'm a teen who is tired of life, although my mental state is perfectly fine and I don't want to die. What is this?","I love a pretty normal life, besides the fact that I am in an online charter school that I do from home. The only real external symptom that I can relate to my sort of ""existential crisis"" is that I have endured prolonged social isolation. 

My family life is good, I have some friends and a sister who's my best friend, and there is stability in my life. I have no problem interacting with people, and have been told I'm very mature.

I also believe in God, so I am rooted comfortably in my faith and don't feel like I'm ""wandering"" or ""lost"". 

However, I am tired of living. I spend most of my time at home doing school, making dinner, cleaning up, working out, and generally feeling productive, but whenever I think of existing tomorrow and the next day, a wave of exhaustion hits me.

I've done some amateur research about what this could be, and at times there were terms like ""brain fog"", ""high functioning stress"", and ""teen burnout"" that I related to at different times, but never wholely. 

I'm asking for myself and others, because I wonder if teens who live pretty normal, low maintenance lives also experience this? Is there anything I should be concerned about or look into further? 

Any meaningful insight is greatly appreciated.",2,1743031409.0,"I'm a teen who is tired of life, although my mental state is perfectly fine and I don't want to die. What is this? I love a pretty normal life, besides the fact that I am in an online charter school that I do from home. The only real external symptom that I can relate to my sort of ""existential crisis"" is that I have endured prolonged social isolation. 

My family life is good, I have some friends and a sister who's my best friend, and there is stability in my life. I have no problem interacting with people, and have been told I'm very mature.

I also believe in God, so I am rooted comfortably in my faith and don't feel like I'm ""wandering"" or ""lost"". 

However, I am tired of living. I spend most of my time at home doing school, making dinner, cleaning up, working out, and generally feeling productive, but whenever I think of existing tomorrow and the next day, a wave of exhaustion hits me.

I've done some amateur research about what this could be, and at times there were terms like ""brain fog"", ""high functioning stress"", and ""teen burnout"" that I related to at different times, but never wholely. 

I'm asking for myself and others, because I wonder if teens who live pretty normal, low maintenance lives also experience this? Is there anything I should be concerned about or look into further? 

Any meaningful insight is greatly appreciated.",positive
1jkkjn5,how the fuck do i get happy?,"I'm so tired of life, I don't get why were here and what it means. Im so tired of being depressed, I'm so fucking tired of feeling okay one day and miserable the next. I feel like im on a roller coaster. My self esteem is always going up and down. I feel like crying but I can't produce any tears and genuinely cry its horrible. when I look around i dont get how people are happy and just living their lives. I don't get why I can't also be happy and live my life. I feel like my life is trash and i think humanity is trash too. I want to not be alive and i think about just getting up from everything and walking away. be homeless, that or kill myself. I don't know where my life is going. I have no friends. I'm not even lonely, and i come on here to throw up my negative feelings because I don't talk to anyone.. im just so tired. Whats the point of it all? ",3,1743017826.0,"how the fuck do i get happy? I'm so tired of life, I don't get why were here and what it means. Im so tired of being depressed, I'm so fucking tired of feeling okay one day and miserable the next. I feel like im on a roller coaster. My self esteem is always going up and down. I feel like crying but I can't produce any tears and genuinely cry its horrible. when I look around i dont get how people are happy and just living their lives. I don't get why I can't also be happy and live my life. I feel like my life is trash and i think humanity is trash too. I want to not be alive and i think about just getting up from everything and walking away. be homeless, that or kill myself. I don't know where my life is going. I have no friends. I'm not even lonely, and i come on here to throw up my negative feelings because I don't talk to anyone.. im just so tired. Whats the point of it all? ",negative
1jkadi3,Suicidal over my tattoo(s),"tw/ suicidal ideation

I’m in therapy, I’m taking meds, I’m even on an antipsychotic. But one thing that has been triggering my OCD and depression is a tattoo on my bicep. It was so cute when I got it 8 years ago. Now years have passed and it looks like shit because it’s warped

I tried a touchup and it still looks bad. For the last three months, every single day I think about it all day every day. I’ve been to removal clinics and they won’t take me because it’s colorful and I’m biracial so apparently I’m just not a good candidate 

Some artists are saying they can cover it but it’s just so colorful and saturated and on such a sensitive spot, it already even has a small scar; I just don’t see it working out in any way for me. And it’s making me super suicidal bc I don’t have any other plausible solutions

Nothing is comforting except sleep. My bf says its fine, my friends say who cares, my grandma even said its fine. None of it comforts me. I feel like I’ve ruined my body and life and there’s nothing I can do to change it

Working? I’m probably going to get fired as this has rendered me non-functional and all I do at work is cry. But since I’m the breadwinner I feel like I need to somehow keep going

Anyways this is probably a first world problem but truly I feel like my life is totally over and I don’t wanna live anymore ",16,1742991477.0,"Suicidal over my tattoo(s) tw/ suicidal ideation

I’m in therapy, I’m taking meds, I’m even on an antipsychotic. But one thing that has been triggering my OCD and depression is a tattoo on my bicep. It was so cute when I got it 8 years ago. Now years have passed and it looks like shit because it’s warped

I tried a touchup and it still looks bad. For the last three months, every single day I think about it all day every day. I’ve been to removal clinics and they won’t take me because it’s colorful and I’m biracial so apparently I’m just not a good candidate 

Some artists are saying they can cover it but it’s just so colorful and saturated and on such a sensitive spot, it already even has a small scar; I just don’t see it working out in any way for me. And it’s making me super suicidal bc I don’t have any other plausible solutions

Nothing is comforting except sleep. My bf says its fine, my friends say who cares, my grandma even said its fine. None of it comforts me. I feel like I’ve ruined my body and life and there’s nothing I can do to change it

Working? I’m probably going to get fired as this has rendered me non-functional and all I do at work is cry. But since I’m the breadwinner I feel like I need to somehow keep going

Anyways this is probably a first world problem but truly I feel like my life is totally over and I don’t wanna live anymore ",negative
1jkpo1c,Replay the scenes,"Long story short...I'm a 27 year old man who was raped. This word is so uncomfortable.

I can't do it... for my therapy I have to write down my *rape*... because it kills my daily life, because the post-traumatic stress is great.

I'm in front of my blank sheet... I have the scenes *especially one* I can almost even feel the pain. My hand is stuck... I don't know where to start, I don't even remember everything. I'm staring into space, it's beyond my strength to cope, I'm in pain. It's too hard to be strong.

I feel the anxiety rising. I'm stressed... by work, my love life, my family life. I think of my mother who doesn't know and who will never know... our bond was broken by actions, choices that I made and is struggling to recover... my heart aches as I write this. I disappointed her, scared her, I don't want to see her cry anymore. I want to let go in his arms. I'm angry at my father for denying me, for being contemptuous, for having been violent, I want to see my ex, I think back to times when everything was fine, I want to be close to him, because I'm afraid, because I need it, I'm alone, alone facing my pain. I'm going in all directions right now.

I still have to face this fucking trauma *I started EMDR* but I want to put it off until later. I think my brain has put that in the locker *must forget, don't talk about it anymore*, my life is punctuated by this trauma. He haunts me...",3,1743030841.0,"Replay the scenes Long story short...I'm a 27 year old man who was raped. This word is so uncomfortable.

I can't do it... for my therapy I have to write down my *rape*... because it kills my daily life, because the post-traumatic stress is great.

I'm in front of my blank sheet... I have the scenes *especially one* I can almost even feel the pain. My hand is stuck... I don't know where to start, I don't even remember everything. I'm staring into space, it's beyond my strength to cope, I'm in pain. It's too hard to be strong.

I feel the anxiety rising. I'm stressed... by work, my love life, my family life. I think of my mother who doesn't know and who will never know... our bond was broken by actions, choices that I made and is struggling to recover... my heart aches as I write this. I disappointed her, scared her, I don't want to see her cry anymore. I want to let go in his arms. I'm angry at my father for denying me, for being contemptuous, for having been violent, I want to see my ex, I think back to times when everything was fine, I want to be close to him, because I'm afraid, because I need it, I'm alone, alone facing my pain. I'm going in all directions right now.

I still have to face this fucking trauma *I started EMDR* but I want to put it off until later. I think my brain has put that in the locker *must forget, don't talk about it anymore*, my life is punctuated by this trauma. He haunts me...",negative
1jkeql2,MY WHOLE LIFE SUCKS AND IS RUINED BY ME,"So iam 18(M) and  iam a huge looser in everything.
I failed in academics , social, life love , family everything.
I was below average student till grade 10 still choose math for higher studies, I was just full of myself and doesn't know how things work my parents made me take admission in very expensive tution and I did home schooling for 11th and 12th grade.
I didn't study at all I was so lazy to do so, literally spent all my time scrolling or using mobile.well then what can you expect
I failed in my 12th grade, I failed in math and physics , I went from preparing for a high level college entrance exam in such expensive tution to failing 12th.
I still gave a college entrance exam I got the results and it was not even 15 percentile.
I was so scared I lied to everyone in my family that I scored 90+ percentile even edited my result and show them the fake one and they still believe it.
That way I was saved last year saying that I forgot to focus on school exams cuz of college entrance exam.
But become I failed 12th grade i had to repeat 12th again and I did.
 now coming back to present after 1 year I gave my final 12th exam yesterday of math and iam 100% sure that I will not get above 70% I did the same mistake as last year. And most imp thing is to get addmission in college in my country you need minimum of 75% in your 12th this means I cannot enter in any good colleges.
While everyone in my family and relatives are thinking that iam sure to get 90% in my 12th result.
Now I have a college entrance exam on 4 April and I have zero preparation for it same as past year.
Iam so scared I can't even describe , I cry everyday thinking how much iam gonna disappoint my parents when my result will come out.
If only I didn't choose to select such hard subjects or not decided to go tution and home schooling instead of just living a normal student life everything might have better.
In the spam of last 3 years I haven't gone anywhere to travel didn't made a single friend, didn't even went out from my house. Everyone in my friend group is doing smthg or is in college iam the only one who is nowhere.
Everytime I see their stories the things they have what they are doing in life it makes me so fucking jeolous.
Some days ago my cousin came who is around 10 , he made a joke about me failing 12th , one of my cousin told me that his mom told them ""study or you will end up like your big brother, a failure"" it literally just break me.
I have no idea what iam gonna do with my life.
I have no future, no friends no one, I never even talked to girl In real life i have a big social enxiety. My looks are even worse I look like shit. 
I was in a online relationship with a girl and it didn't even last a month, I was so insecure that I didn't even showed her my face.
Just heard some days ago that she has a new boyfriend now.
I just feel so useless.
There are so many more stuffs but iam sure you just gonna get bored reading that.

Rn I have entrance exam on 4 April, well iam faking that iam sick and gonna skip the exam.
As For my 12th if I didn't score 75% i will give  a improvement exam to increase my marks.
And will take a drop year to prepare for college exams.

But what iam scared of is what everyone gonna think of me , iam so scared of people judging me to the point I just act like the way they want me to , so they don't think bad of me. I feel like iam just trapped cannot figure out what I really am.
another thing I lie often, almost about everything almost everyone who knows me , they don't know me at all becouse everything I told them abt me is lie. I just feel so ashamed of myself abt everything.
I even scared rn that everyone here gonna judge me for this.
Just posting this cuz I don't know what to do maybe I feel better after that.
I am gonna kms soon anyways. ",8,1743003594.0,"MY WHOLE LIFE SUCKS AND IS RUINED BY ME So iam 18(M) and  iam a huge looser in everything.
I failed in academics , social, life love , family everything.
I was below average student till grade 10 still choose math for higher studies, I was just full of myself and doesn't know how things work my parents made me take admission in very expensive tution and I did home schooling for 11th and 12th grade.
I didn't study at all I was so lazy to do so, literally spent all my time scrolling or using mobile.well then what can you expect
I failed in my 12th grade, I failed in math and physics , I went from preparing for a high level college entrance exam in such expensive tution to failing 12th.
I still gave a college entrance exam I got the results and it was not even 15 percentile.
I was so scared I lied to everyone in my family that I scored 90+ percentile even edited my result and show them the fake one and they still believe it.
That way I was saved last year saying that I forgot to focus on school exams cuz of college entrance exam.
But become I failed 12th grade i had to repeat 12th again and I did.
 now coming back to present after 1 year I gave my final 12th exam yesterday of math and iam 100% sure that I will not get above 70% I did the same mistake as last year. And most imp thing is to get addmission in college in my country you need minimum of 75% in your 12th this means I cannot enter in any good colleges.
While everyone in my family and relatives are thinking that iam sure to get 90% in my 12th result.
Now I have a college entrance exam on 4 April and I have zero preparation for it same as past year.
Iam so scared I can't even describe , I cry everyday thinking how much iam gonna disappoint my parents when my result will come out.
If only I didn't choose to select such hard subjects or not decided to go tution and home schooling instead of just living a normal student life everything might have better.
In the spam of last 3 years I haven't gone anywhere to travel didn't made a single friend, didn't even went out from my house. Everyone in my friend group is doing smthg or is in college iam the only one who is nowhere.
Everytime I",negative
