id,title,selftext,score,created_utc,full_text,label
1jkm85i,I’m so fucking over it,"I'm so fucking over my depression, it switches from high to low functioning but when it's high functioning and I tell people I have depression almost the the fucking time they hit me with the ""you don't look depressed"" or "" here up it's not that bad"" and I wanna punch them in the fucking throat. It is that bad you bitch and no I can't just cheer up I don't why my brain is like this but it just is and apologies for forgetting my black cloud and neon "" THIS FUCKER DEPRESSED"" sign at home and I'm so fucking done with it.",3,1743021944.0,"I’m so fucking over it I'm so fucking over my depression, it switches from high to low functioning but when it's high functioning and I tell people I have depression almost the the fucking time they hit me with the ""you don't look depressed"" or "" here up it's not that bad"" and I wanna punch them in the fucking throat. It is that bad you bitch and no I can't just cheer up I don't why my brain is like this but it just is and apologies for forgetting my black cloud and neon "" THIS FUCKER DEPRESSED"" sign at home and I'm so fucking done with it.",negative
1jkm0o9,Just want to disappear,"I'm lonely as anything now. It was all due to my own actions... I wish I sometimes never breathed the next morning so I could disappear to nothingness... 

I drove people away during my worst, ruined relationships and now I'm alone again... I just want to disappear of this earth, I hope I can just one day drop dead.

They asked don't let it destroy you well i guess it did and frankly I'm tired of continue to live. 

I think if I don't have much going on for me by 30s then I'm calling it quits yup. There's no point in it anymore, If I keep managing to fuck it all up.",3,1743021417.0,"Just want to disappear I'm lonely as anything now. It was all due to my own actions... I wish I sometimes never breathed the next morning so I could disappear to nothingness... 

I drove people away during my worst, ruined relationships and now I'm alone again... I just want to disappear of this earth, I hope I can just one day drop dead.

They asked don't let it destroy you well i guess it did and frankly I'm tired of continue to live. 

I think if I don't have much going on for me by 30s then I'm calling it quits yup. There's no point in it anymore, If I keep managing to fuck it all up.",negative
1jklhgi,Nothing fulfills me at all.,If I can't find my purpose in life Im fucking done,3,1743020120.0,Nothing fulfills me at all. If I can't find my purpose in life Im fucking done,negative
1jkohe5,Hello any help would be appreciated sorry it’s so long,"Hello I hope this belongs here i posted on multiple pages for any help or info I am a 22 about to be 23 year old male living in south jersey (Cherry hill area) and I am struggling and don’t know where to start any help or tips or guidance would be so appreciated and needed. I am just trying to be a better person and husband. I apologize in advance for any spelling errors or weirdly worded sentences I’m trying but it’s really hard to get my thoughts on paper.

(Some background on my life my father passed away about a month ago tbh it didn’t quite affect me really my father was a bad dude sold drugs and was in prison half my life my mother passed when I was 7 I loved her but now a days I don’t remember her much at all and when I see pictures of her I almost don’t know who it is. My family is pretty messed most of them are either on drugs or on the news for selling them/hurting people. Most of the men in my family are in gangs including my father and he was there when I was jumped in that was the most proud I ever seen him. I was in foster care for a while and then adopted when I was 9/10 to a terrible family who treated me and the other kids they adopted like house slaves… I’m talking every door in the house locked,pantry locked .some of the adopted kids wernt even allowed to to eat at the same time as the family. I left there when I was 16 and got emancipated shortly after. I am not alone I found a friend and over time he became my brother and his mom took me in as her own calls me son shows me off on Facebook with her other kids she loves me. I have people in my corner they are just not sure how to help and I’m not even sure how to help myself or where to begin honestly I’m hoping a lot of people see this and are able to toss some suggestions my way.

This is What is happening 

I can’t focus on multiple things I can’t multi task I end up forgetting steps or forgetting a task all together 

I can’t keep up with responsibilities or bills because my focus can only be on one thing 

I am feeling so frustrated and irritated all the time now very little happy moments 

I’ve only been eating one meal a day for about 2 or 3 months now losing my hunger for food I only eat when my stomach starts to hurt 

Getting out of bed in the mornings is a losing battle every time I’m late to work damn near everyday 

I feel like I’ve been declining and now one can help me and it won’t get better I was hopeful in the beginning that I would feel better I no longer have that hope I hate everyday 

All I wanna do is lay in bed and sleep all day but I can’t sleep even tho I’m exhausted I’m exhausted everyday even after waking up from a lot off sleep

I am randomly super anxious at random points in the day and I’m not sure what brings on such a heavy unsettling feeling like something is wrong 

Remembering to take medication or remembering I have an appointment is damn near impossible I forget as soon as I’m told 

My procrastination has gotten so bad I will save something intill the absolute last second and then be extremely upset that I am feeling rushed 

I never did well in school because I can’t just sit still and have someone speak to me my body won’t stop moving whether it’s twirling my fingers or shaking my legs",2,1743027725.0,"Hello any help would be appreciated sorry it’s so long Hello I hope this belongs here i posted on multiple pages for any help or info I am a 22 about to be 23 year old male living in south jersey (Cherry hill area) and I am struggling and don’t know where to start any help or tips or guidance would be so appreciated and needed. I am just trying to be a better person and husband. I apologize in advance for any spelling errors or weirdly worded sentences I’m trying but it’s really hard to get my thoughts on paper.

(Some background on my life my father passed away about a month ago tbh it didn’t quite affect me really my father was a bad dude sold drugs and was in prison half my life my mother passed when I was 7 I loved her but now a days I don’t remember her much at all and when I see pictures of her I almost don’t know who it is. My family is pretty messed most of them are either on drugs or on the news for selling them/hurting people. Most of the men in my family are in gangs including my father and he was there when I was jumped in that was the most proud I ever seen him. I was in foster care for a while and then adopted when I was 9/10 to a terrible family who treated me and the other kids they adopted like house slaves… I’m talking every door in the house locked,pantry locked .some of the adopted kids wernt even allowed to to eat at the same time as the family. I left there when I was 16 and got emancipated shortly after. I am not alone I found a friend and over time he became my brother and his mom took me in as her own calls me son shows me off on Facebook with her other kids she loves me. I have people in my corner they are just not sure how to help and I’m not even sure how to help myself or where to begin honestly I’m hoping a lot of people see this and are able to toss some suggestions my way.

This is What is happening 

I can’t focus on multiple things I can’t multi task I end up forgetting steps or forgetting a task all together 

I can’t keep up with responsibilities or bills because my focus can only be on one thing 

I am feeling so frustrated and irritated all",negative
1jko47y,I am tired,"I feel as if I’m nothing. I wake up every morning to feel the same as the day before. I’m drained, I’m lost, I’m struggling with life. I feel easily replaced and always left out. I feel as if I will never be anybody’s first choice because I’m always the backup. Everyone has someone that they will choose before me. I’ve finally accepted that I am no one’s favorite person. I feel as if everything I love, I just lose it. Whether it’s a person or an object. Sometimes I wonder if I’m really that bad. I’m never happy, I always fake it. I’m always annoying people, disappointing people, making mistakes, I feel like there’s something wrong with me. I try my hardest but no one ever sees it and always says I don’t try, but I do. I have no one, and if I do, they always leave. I feel like such a failure.",2,1743026759.0,"I am tired I feel as if I’m nothing. I wake up every morning to feel the same as the day before. I’m drained, I’m lost, I’m struggling with life. I feel easily replaced and always left out. I feel as if I will never be anybody’s first choice because I’m always the backup. Everyone has someone that they will choose before me. I’ve finally accepted that I am no one’s favorite person. I feel as if everything I love, I just lose it. Whether it’s a person or an object. Sometimes I wonder if I’m really that bad. I’m never happy, I always fake it. I’m always annoying people, disappointing people, making mistakes, I feel like there’s something wrong with me. I try my hardest but no one ever sees it and always says I don’t try, but I do. I have no one, and if I do, they always leave. I feel like such a failure.",negative
1jknw2a,Will something change or is it like this forever?,"Hello everyone! I’m new here, so far I’m just trying to figure out how to write something and in general, with the platform interface. Since I’m not from an English-speaking country, but a Slav, I need time to understand how everything works here.

Closer to the point. I don’t know how to call what I feel or what’s inside me. But it seems that only 4-5 years ago I realized that I have been suffering almost all my life.

Some changes in life often only made worse, but rather because of their own choice or vice versa, not being able to influence events. Plus, a lot of problems and losses have happened over the years. Life leaves no choice and knows no pity. I’m surprised by all those lucky people who manage to complain about life at the same time. And sometimes it’s not just about the family or where you were born, how much money you have, but about the fact that inside you seem to die or dead, and wherever you go, no matter what happens, you remain dead.

I know that I’m not the best person, and I don’t consider myself strong. But still, transformations have taken place and are happening, I analyze more and more correctly with age. I have always been inclined to analyze everything and myself! But understanding doesn’t mean changing everything at once, I can’t control many things even in myself. I’m my own worst enemy. Whether it’s true or not, I see that the world never wants to help either.

But despite the fact that I don’t like people.

I would like to possibly share my story. I don’t know why myself.",2,1743026182.0,"Will something change or is it like this forever? Hello everyone! I’m new here, so far I’m just trying to figure out how to write something and in general, with the platform interface. Since I’m not from an English-speaking country, but a Slav, I need time to understand how everything works here.

Closer to the point. I don’t know how to call what I feel or what’s inside me. But it seems that only 4-5 years ago I realized that I have been suffering almost all my life.

Some changes in life often only made worse, but rather because of their own choice or vice versa, not being able to influence events. Plus, a lot of problems and losses have happened over the years. Life leaves no choice and knows no pity. I’m surprised by all those lucky people who manage to complain about life at the same time. And sometimes it’s not just about the family or where you were born, how much money you have, but about the fact that inside you seem to die or dead, and wherever you go, no matter what happens, you remain dead.

I know that I’m not the best person, and I don’t consider myself strong. But still, transformations have taken place and are happening, I analyze more and more correctly with age. I have always been inclined to analyze everything and myself! But understanding doesn’t mean changing everything at once, I can’t control many things even in myself. I’m my own worst enemy. Whether it’s true or not, I see that the world never wants to help either.

But despite the fact that I don’t like people.

I would like to possibly share my story. I don’t know why myself.",negative
1jkf0rm,Sex life and how to deal with it as a partner,"I am so tired of trying to be understanding the constant rejection. My partner has type 2 bipolar disorder (mostly lows) and he has iniated sex max. 3 times in 6 years. I have a medium sex drive and he is down seldom and im worried about the future: what if nothing ever changes? Im positive the depressive episodes arent going anywhere but its most of the year this way and i feel so unwanted. He doesnt want to talk about it much.

People suffering from depression and having low sex drive: how would you like this to be approached?

Partners: how do you deal with this?",6,1743004299.0,"Sex life and how to deal with it as a partner I am so tired of trying to be understanding the constant rejection. My partner has type 2 bipolar disorder (mostly lows) and he has iniated sex max. 3 times in 6 years. I have a medium sex drive and he is down seldom and im worried about the future: what if nothing ever changes? Im positive the depressive episodes arent going anywhere but its most of the year this way and i feel so unwanted. He doesnt want to talk about it much.

People suffering from depression and having low sex drive: how would you like this to be approached?

Partners: how do you deal with this?",negative
1jkf6vy,What do I do,"I’m depressed 
Life is hard 
But easy 
Idk what I should do maybe I shouldnt do anything 
",4,1743004724.0,"What do I do I’m depressed 
Life is hard 
But easy 
Idk what I should do maybe I shouldnt do anything 
",negative
1jkr48n,Is it worth living for other people?,"I felt for a very long time that the only reason I have to live is to not make a few people upset. I think about how badly I want to die every day, for most of the day. I fantasize about it constantly. The only thing keeping me here is knowing my brother and my ex will be very upset. 

Is it worth living to save maybe 2 people from being sad?",1,1743034791.0,"Is it worth living for other people? I felt for a very long time that the only reason I have to live is to not make a few people upset. I think about how badly I want to die every day, for most of the day. I fantasize about it constantly. The only thing keeping me here is knowing my brother and my ex will be very upset. 

Is it worth living to save maybe 2 people from being sad?",negative
1jkr21b,Find yourself,"Actually, I don't know what to do right now, yes, I have to start somewhere, but I don't know where and how to start because I always cut the strings of my life were in other people' hands, but I cut it and fell, but I'm going to get up and get up and as someone else. but it's like I feel like I've lost my hope a little bit, I don't know who to trust, I don't know who to be friends, everyone sees the truths as good as their benefit of this life, but they think I don't see it, in fact, I didn't want anything from anyone, all I wanted was trust, respect and love, but from what I've as far as I've seen, these are just when you act as work for them, on the contrary, if you want to be yourself, you're always ",1,1743034607.0,"Find yourself Actually, I don't know what to do right now, yes, I have to start somewhere, but I don't know where and how to start because I always cut the strings of my life were in other people' hands, but I cut it and fell, but I'm going to get up and get up and as someone else. but it's like I feel like I've lost my hope a little bit, I don't know who to trust, I don't know who to be friends, everyone sees the truths as good as their benefit of this life, but they think I don't see it, in fact, I didn't want anything from anyone, all I wanted was trust, respect and love, but from what I've as far as I've seen, these are just when you act as work for them, on the contrary, if you want to be yourself, you're always ",negative
1jkikob,My therapist and boyfriend want me to go back on meds,So basically I’ve been on anti anxiety meds since I was 13 and recently (with in the past year) got on anti depressants as well. I stoped taking them because it made me feel crazy having to take 3 pills every single day and I didn’t feel like they were helping as well as I wanted them too. But since I’ve stoped taking them I’ve been thrown into a depressive episode and picked up some old bad habits. Now my boyfriend and therapist want me back on medication. What should I do? ,3,1743012967.0,My therapist and boyfriend want me to go back on meds So basically I’ve been on anti anxiety meds since I was 13 and recently (with in the past year) got on anti depressants as well. I stoped taking them because it made me feel crazy having to take 3 pills every single day and I didn’t feel like they were helping as well as I wanted them too. But since I’ve stoped taking them I’ve been thrown into a depressive episode and picked up some old bad habits. Now my boyfriend and therapist want me back on medication. What should I do? ,negative
1jkqyn9,"I have autism, ADHD, and depression. How do I beat my phone addiction?","I swear to God I hate technology. Curse this fucking bullshit because I can't focus for one second without wanting to use YouTube or social media. Blockers don't work because I would just bypass them, Deleting them doesn't work because I'll just download them again. Nothing I tried works. What do I do?",1,1743034337.0,"I have autism, ADHD, and depression. How do I beat my phone addiction? I swear to God I hate technology. Curse this fucking bullshit because I can't focus for one second without wanting to use YouTube or social media. Blockers don't work because I would just bypass them, Deleting them doesn't work because I'll just download them again. Nothing I tried works. What do I do?",negative
1jkqwp1,Lost and Confused,I 36/M feel down because I found that my wife 33/F cheated we have been together for 13 years. We're going to start some counseling because we have kids together and I want to work our things out. I feel down want yell scream but I can't. I can't really count on family for that because they are quick to judge and start talking to everyone. Can't say I have friends for this either cause they will also judge I just want to be able to get through this but don't know what else to do. I know someone can relate to my situation and would genuinely like to ask how you got through that situation it might be different and difficult for each person but would like to hear some or your responses. Can any relate? ,1,1743034189.0,Lost and Confused I 36/M feel down because I found that my wife 33/F cheated we have been together for 13 years. We're going to start some counseling because we have kids together and I want to work our things out. I feel down want yell scream but I can't. I can't really count on family for that because they are quick to judge and start talking to everyone. Can't say I have friends for this either cause they will also judge I just want to be able to get through this but don't know what else to do. I know someone can relate to my situation and would genuinely like to ask how you got through that situation it might be different and difficult for each person but would like to hear some or your responses. Can any relate? ,negative
