id,title,selftext,score,created_utc,full_text,label
1jkf0ke,I'm a failure and I don't deserve to live,"19F here. I hate myself with every fiber of my being. I have no goals, no passions, no talents, no ambition, or any unique traits that make me ""me."" I'm dumb and I'm failing my classes, and I don't even have the energy to even get out of bed, let alone actually study to improve myself. My soul is tired, and I just want the lines between sleep and death to blur at this point because no amount of rest is enough when your exhaustion is not physical anymore. I've given up any hope for the chances of my life being better because it's not going anywhere, and the path ahead is chronically lonely and uncertain.

What makes everything worse is that I have severe ADHD which is untreated, and I dissociate daily. I don't even have the means to get them treated, and the overwhelming guilt from wasting my life away is killing me slowly, and yet I still can't pull myself together.


I'm a worthless failure, and I don't deserve to live. I hope one day I'll stop being afraid of death and spare everyone the trouble of dealing with me by killing myself",23,1743004285.0,"I'm a failure and I don't deserve to live 19F here. I hate myself with every fiber of my being. I have no goals, no passions, no talents, no ambition, or any unique traits that make me ""me."" I'm dumb and I'm failing my classes, and I don't even have the energy to even get out of bed, let alone actually study to improve myself. My soul is tired, and I just want the lines between sleep and death to blur at this point because no amount of rest is enough when your exhaustion is not physical anymore. I've given up any hope for the chances of my life being better because it's not going anywhere, and the path ahead is chronically lonely and uncertain.

What makes everything worse is that I have severe ADHD which is untreated, and I dissociate daily. I don't even have the means to get them treated, and the overwhelming guilt from wasting my life away is killing me slowly, and yet I still can't pull myself together.


I'm a worthless failure, and I don't deserve to live. I hope one day I'll stop being afraid of death and spare everyone the trouble of dealing with me by killing myself",negative
1jknvuo,I’m just over this shit called “life”,"It never gets better. You just get better at hiding it. Til you realize it just ain't worth the trouble. More so, your very existence isn't worth it. Just have to let go. ",6,1743026167.0,"I’m just over this shit called “life” It never gets better. You just get better at hiding it. Til you realize it just ain't worth the trouble. More so, your very existence isn't worth it. Just have to let go. ",negative
1jkjhal,I just wanna not to wake up anymore,"it's too suffering ti live every day, i don't think i have to suffer so much, i am tired",13,1743015209.0,"I just wanna not to wake up anymore it's too suffering ti live every day, i don't think i have to suffer so much, i am tired",negative
1jk389y,I used to post nudes online for validation and am feeling suicidal over how it's more than likely ruined my life.,"As of recently, I posted nudes on reddit over the last year whenever I was feeling low about myself and craving connection in the moment. In total, I have probably posted about 20 nudes on here (none showing my face). Some of them have even ended up on porn sites. But it didn't hit me until tonight how most men would consider this a dealbreaker and gross and it made me break down crying and like I've permanently ruined my life. I now no longer feel like I would want to get close to any guy in the future because I know he'll more than likely leave me once he finds out my past. I will be seen as gross, unlovable and worthless now. I've been depressed for like 2 hours now and feeling hopeless.",163,1742961749.0,"I used to post nudes online for validation and am feeling suicidal over how it's more than likely ruined my life. As of recently, I posted nudes on reddit over the last year whenever I was feeling low about myself and craving connection in the moment. In total, I have probably posted about 20 nudes on here (none showing my face). Some of them have even ended up on porn sites. But it didn't hit me until tonight how most men would consider this a dealbreaker and gross and it made me break down crying and like I've permanently ruined my life. I now no longer feel like I would want to get close to any guy in the future because I know he'll more than likely leave me once he finds out my past. I will be seen as gross, unlovable and worthless now. I've been depressed for like 2 hours now and feeling hopeless.",negative
1jkqx5j,im tryna be strong. but who fucking cares,"i do have to acknowledge im being strong. this shit ain't easy. living with no will and purpose to do so. daily consumed by my own insignificance in everyone else's lives. financial issues, academic & work pressure, schizophrenic dad who i'm currently holding a lawsuit against, alcoholic mother that drowns herself in beer to alleviate a whole life worth of suffering and i can't help her. Broken friendships and relationships, a man that pretended to be my best friend for two years just to take advantage of me when i was vulnerable. He used and used and used me till he got tired and threw me away like an used condom. i was nothing more than his sex doll. the friend i've most loved. cheated on me twice, and even slept with my best friend. i've been twice backstabbed at the same time and lost everyone i loved. 

",3,1743034223.0,"im tryna be strong. but who fucking cares i do have to acknowledge im being strong. this shit ain't easy. living with no will and purpose to do so. daily consumed by my own insignificance in everyone else's lives. financial issues, academic & work pressure, schizophrenic dad who i'm currently holding a lawsuit against, alcoholic mother that drowns herself in beer to alleviate a whole life worth of suffering and i can't help her. Broken friendships and relationships, a man that pretended to be my best friend for two years just to take advantage of me when i was vulnerable. He used and used and used me till he got tired and threw me away like an used condom. i was nothing more than his sex doll. the friend i've most loved. cheated on me twice, and even slept with my best friend. i've been twice backstabbed at the same time and lost everyone i loved. 

",negative
1jjvp6t,I wish I had the courage to kill myself,"I am so fucking tired of this life. I go to bed every night hoping and wishing I don’t wake up the next day. Everyone I have ever loved or gotten closed to has left me after a while. I have given up on people. I have zero social life. I go to work everyday, come home and then go to my room. This life isn’t worth living.

But the only problem is that I don’t have it in me to actually go through with it. I have thought about a lot of different ways of suicide but I can’t imagine doing it. I keep hoping for a natural death or an accident of some sort but that is unfortunately not very likely.",343,1742940103.0,"I wish I had the courage to kill myself I am so fucking tired of this life. I go to bed every night hoping and wishing I don’t wake up the next day. Everyone I have ever loved or gotten closed to has left me after a while. I have given up on people. I have zero social life. I go to work everyday, come home and then go to my room. This life isn’t worth living.

But the only problem is that I don’t have it in me to actually go through with it. I have thought about a lot of different ways of suicide but I can’t imagine doing it. I keep hoping for a natural death or an accident of some sort but that is unfortunately not very likely.",negative
1jkns1l,I want to end my life,"I (17f) have been struggling with severe depression for 6 months. I was in mental hospital multiple times and now am taking medications for 2 months. I was feeling better but it's getting worse again. 

I feel too old to have this problem, I feel childish. I know people are usually depressed around 14-16. Everyone in the mental hospital was younger then 16. 

I hate myself, I hate myself so much. I brought so much pain to my family, I wish I was just gone. If I fail to kill myself again, I will go to mental hospital again and I can't risk that. My parents will be so sad and will never trust me again.

I already left my dream school because of panick attacks, we were able to find a new one, but I am so dissapointed in myself.

I started therapy, but I just feel worse.

Please tell me just how to end it easily. I can't live like this.",5,1743025893.0,"I want to end my life I (17f) have been struggling with severe depression for 6 months. I was in mental hospital multiple times and now am taking medications for 2 months. I was feeling better but it's getting worse again. 

I feel too old to have this problem, I feel childish. I know people are usually depressed around 14-16. Everyone in the mental hospital was younger then 16. 

I hate myself, I hate myself so much. I brought so much pain to my family, I wish I was just gone. If I fail to kill myself again, I will go to mental hospital again and I can't risk that. My parents will be so sad and will never trust me again.

I already left my dream school because of panick attacks, we were able to find a new one, but I am so dissapointed in myself.

I started therapy, but I just feel worse.

Please tell me just how to end it easily. I can't live like this.",negative
1jknn8i,Hi Im looking for someone else who is depressed to talk to,Hi I’m depressed and looking for someone to talk to. I’m a guy 37 years old. Just want to talk about stuff related to depression. Thanks.,4,1743025557.0,Hi Im looking for someone else who is depressed to talk to Hi I’m depressed and looking for someone to talk to. I’m a guy 37 years old. Just want to talk about stuff related to depression. Thanks.,negative
1jknen0,What's the point of living,"There are times when one has a hope for better tomorrow and then there are moments where you want to sleep and never wake-up. Life seems like a simulation and i am just a pawn on chessboard, doomed to be sacrificed.",4,1743024949.0,"What's the point of living There are times when one has a hope for better tomorrow and then there are moments where you want to sleep and never wake-up. Life seems like a simulation and i am just a pawn on chessboard, doomed to be sacrificed.",negative
1jkpbe6,worse and worse and worse and worse,"I'm so tired of everything. I stopped caring about school, which I never did, even two hears ago when I tried to kill myself. Now I can't even do a quick reminder for exams, I haven't done a single homework in few months, I don't want to learn anything anymore which is crazy cause I loved learning so much. I'm just drowning deeper and deeper in apathy. Today I walked on a street after I saw speeding auto but unfortunately they slowed down after seeing me. I don't want to be this way so fucking much I wish it would all end and I could feel at peace without feeling pain",3,1743029935.0,"worse and worse and worse and worse I'm so tired of everything. I stopped caring about school, which I never did, even two hears ago when I tried to kill myself. Now I can't even do a quick reminder for exams, I haven't done a single homework in few months, I don't want to learn anything anymore which is crazy cause I loved learning so much. I'm just drowning deeper and deeper in apathy. Today I walked on a street after I saw speeding auto but unfortunately they slowed down after seeing me. I don't want to be this way so fucking much I wish it would all end and I could feel at peace without feeling pain",negative
1jkiie0,I have no faith in humanity. I also hate everything about me.,"I just can’t anymore. 

1. Coerced into debt 

2. Forced to work job I hate 

3. Internally job is ruining everything for me 

4. Get extremely stressed and depressed 

5. No way out - trapped - Don’t do drugs or alcohol

6. Turn to smoking, food and trying to buy happiness

7. End up in worse physical and financial situation

8. Trapped in paradox of need to work, but need to spend earnings to function. Mental health decline

9. Eventually struggle and claw my way out of hell hating every minute of it. Come out older, more jaded and less of a man 

10. Finally able to breathe. But time spent climbing out makes everything feel pointless and hopeless despite “making it”

11. Due to one reason or another, life circumstance - more coercion etc. - Repeat step one 


This has been my life story… and believe me when I say I never wanted debt. Never carried it before. Never wanted to carry it but was left with no choice… or maybe there was a choice, but I was pressured into it… 
then again, the alternative was just as bad…

Always tried to be smart and stay ahead… now scraping the bottom of the barrel. My life has been nothing, but pain, wanting vindication, never getting it and getting kicked and taunted while down. 

I hate it. I hate it all. I want to die. ",6,1743012809.0,"I have no faith in humanity. I also hate everything about me. I just can’t anymore. 

1. Coerced into debt 

2. Forced to work job I hate 

3. Internally job is ruining everything for me 

4. Get extremely stressed and depressed 

5. No way out - trapped - Don’t do drugs or alcohol

6. Turn to smoking, food and trying to buy happiness

7. End up in worse physical and financial situation

8. Trapped in paradox of need to work, but need to spend earnings to function. Mental health decline

9. Eventually struggle and claw my way out of hell hating every minute of it. Come out older, more jaded and less of a man 

10. Finally able to breathe. But time spent climbing out makes everything feel pointless and hopeless despite “making it”

11. Due to one reason or another, life circumstance - more coercion etc. - Repeat step one 


This has been my life story… and believe me when I say I never wanted debt. Never carried it before. Never wanted to carry it but was left with no choice… or maybe there was a choice, but I was pressured into it… 
then again, the alternative was just as bad…

Always tried to be smart and stay ahead… now scraping the bottom of the barrel. My life has been nothing, but pain, wanting vindication, never getting it and getting kicked and taunted while down. 

I hate it. I hate it all. I want to die. ",negative
1jkoxul,How I feel!!,"Depression feels like waking up at the bottom of a deep pit, covered in heavy, wet, freezing muck. You look up and see a faint light, but then the voices start. That’s not good enough. Why did she say that? You’re fat. They echo down, relentless, one after another, piling on like the weight of the muck itself.

Somehow, you force yourself to move, pushing through the cold, clinging heaviness. You’re exhausted, but you keep going, drawn toward the light, even as fear gnaws at you—what’s waiting up there? Gathering every bit of strength, you climb. The voices don’t stop; they scream in your ears as you fight your way up.

Finally, you reach the top, gasping for air, only to be met with dismissive words: You should smile more. Don’t feel that way. Everyone has bad days. And just like that, everyone disappears, leaving you alone with the noise in your head, replaying over and over and over again. 

I’m not looking for attention or anything like that I’m just putting it out there how I feel.",3,1743028944.0,"How I feel!! Depression feels like waking up at the bottom of a deep pit, covered in heavy, wet, freezing muck. You look up and see a faint light, but then the voices start. That’s not good enough. Why did she say that? You’re fat. They echo down, relentless, one after another, piling on like the weight of the muck itself.

Somehow, you force yourself to move, pushing through the cold, clinging heaviness. You’re exhausted, but you keep going, drawn toward the light, even as fear gnaws at you—what’s waiting up there? Gathering every bit of strength, you climb. The voices don’t stop; they scream in your ears as you fight your way up.

Finally, you reach the top, gasping for air, only to be met with dismissive words: You should smile more. Don’t feel that way. Everyone has bad days. And just like that, everyone disappears, leaving you alone with the noise in your head, replaying over and over and over again. 

I’m not looking for attention or anything like that I’m just putting it out there how I feel.",negative
1jk6xg7,Why do people value life,"I don't want to break the sub rules, but... Why are people so obsessed with living, it's not like life is  constant pleasure... right? It's really really strange to live life as someone doesn't really enjoy living and see all those people telling you that life is so valuable and that you will regret dying like If you can resurrect or something #lol",40,1742977383.0,"Why do people value life I don't want to break the sub rules, but... Why are people so obsessed with living, it's not like life is  constant pleasure... right? It's really really strange to live life as someone doesn't really enjoy living and see all those people telling you that life is so valuable and that you will regret dying like If you can resurrect or something #lol",negative
1jko3g6,i'm a failure that deserves nothing,"i hate myself more than anything in this stupid world. i feel like such a horrible selfish lazy and evil person constantly. i can't stand it. i hate myself so much. i don't try hard enough to get better, any time i'm faced with reality i just sob because i can't handle anything. i have no passion, no motivation, no energy for anything. i just deserve to die for being so pathetic and terrible. i can't get myself to learn how to drive or get a job, and i'm turning 18 just next week. i can't handle it. i quit before i even start. i'm so pathetic. i can't handle anything, i just want to be happy. i'm sorry that i'm so selfish and terrible. i cope by being childish, i just wanna be taken care of a little bit and happy. i just want to play with dolls and do fun things. there's too much going on in my head, too many things conflicting. it hurts. nobody understands me, i don't even understand myself. i just wish i was normal like everybody else. i feel like everybody hates me. it's a miracle anybody stays with me; i'm terrified of being abandoned. i try desperately to not cause problems but it's so hard to push my feelings away. i don't think i deserve any kindness or sympathy for being so terrible. i'm sorry that i'm like this. people only pity me i'm sure",3,1743026705.0,"i'm a failure that deserves nothing i hate myself more than anything in this stupid world. i feel like such a horrible selfish lazy and evil person constantly. i can't stand it. i hate myself so much. i don't try hard enough to get better, any time i'm faced with reality i just sob because i can't handle anything. i have no passion, no motivation, no energy for anything. i just deserve to die for being so pathetic and terrible. i can't get myself to learn how to drive or get a job, and i'm turning 18 just next week. i can't handle it. i quit before i even start. i'm so pathetic. i can't handle anything, i just want to be happy. i'm sorry that i'm so selfish and terrible. i cope by being childish, i just wanna be taken care of a little bit and happy. i just want to play with dolls and do fun things. there's too much going on in my head, too many things conflicting. it hurts. nobody understands me, i don't even understand myself. i just wish i was normal like everybody else. i feel like everybody hates me. it's a miracle anybody stays with me; i'm terrified of being abandoned. i try desperately to not cause problems but it's so hard to push my feelings away. i don't think i deserve any kindness or sympathy for being so terrible. i'm sorry that i'm like this. people only pity me i'm sure",negative
1jknr65,"Hobbies, GDD, gifted kid syndrome","I guess I’ll try to keep it short. I literally do nothing but work and sleep. My only real hobby is dissociation and sleeping. There’s things I like to do, but because I’m not amazing at them immediately they’re draining rather than fulfilling, and I end up wasting weeks staring at the wall and scrolling. Does anyone have any anecdotes about working through this?? If powering through worked it would have by now. Literally any sliver of advice, I’m willing to try anything ",3,1743025834.0,"Hobbies, GDD, gifted kid syndrome I guess I’ll try to keep it short. I literally do nothing but work and sleep. My only real hobby is dissociation and sleeping. There’s things I like to do, but because I’m not amazing at them immediately they’re draining rather than fulfilling, and I end up wasting weeks staring at the wall and scrolling. Does anyone have any anecdotes about working through this?? If powering through worked it would have by now. Literally any sliver of advice, I’m willing to try anything ",negative
1jkqlya,Im 24 yrs old and my 6yr old little sister saw me cut myself,"I feel embarrassed, ashamed and so hopeless all at once. These past couple of years have been traumatic emotionally and I haven't found ways to cope in a healthy manner. I was sent to a psychiatric hospital last year and it helped me only for a moment. I've been feeling very depressed again because I feel like the direction of my love life, job and social life have been very fulfilling in any way. I was drinking and crying at the same time and the only thing that gave me some relief at the time was cutting myself. I believed things would be better off without me, and I didn't want to have to worry about losing anything else. I began to cut myself to feel some sense of power and control many times before my little sister walked into the room unexpectedly. She just stared at me and asked me why was I crying and I didn't have any words to say and she just kept asking if I was okay. The thing is sometimes I don't even feel like people around my age or my parents even notice the things I go through or the things that make me feel super upset, but once my little sister asked me that question, I tried to be as passive but honest as possible. I told her I was having a hard time and needed to cry, and she just gave me a hug and asked if she helped me feel better. And something like that, I feel like is all I need from others. Just wanted to share this.",2,1743033373.0,"Im 24 yrs old and my 6yr old little sister saw me cut myself I feel embarrassed, ashamed and so hopeless all at once. These past couple of years have been traumatic emotionally and I haven't found ways to cope in a healthy manner. I was sent to a psychiatric hospital last year and it helped me only for a moment. I've been feeling very depressed again because I feel like the direction of my love life, job and social life have been very fulfilling in any way. I was drinking and crying at the same time and the only thing that gave me some relief at the time was cutting myself. I believed things would be better off without me, and I didn't want to have to worry about losing anything else. I began to cut myself to feel some sense of power and control many times before my little sister walked into the room unexpectedly. She just stared at me and asked me why was I crying and I didn't have any words to say and she just kept asking if I was okay. The thing is sometimes I don't even feel like people around my age or my parents even notice the things I go through or the things that make me feel super upset, but once my little sister asked me that question, I tried to be as passive but honest as possible. I told her I was having a hard time and needed to cry, and she just gave me a hug and asked if she helped me feel better. And something like that, I feel like is all I need from others. Just wanted to share this.",negative
1jkgqi5,What tf is wrong with me?,"What is wrong with me? I can't get up to study, I can't even clean my room. I come home at 2 p.m. After school and I lay down in my bed till I fall asleep.
I binge watch TV shows the whole day basically and I cry every day in school. I can't do this anymore. I tried everything to get better, and now I'm at rock bottom... I don't know what to do and I have no energy to figure out what's wrong with me. I want to give up.",7,1743008527.0,"What tf is wrong with me? What is wrong with me? I can't get up to study, I can't even clean my room. I come home at 2 p.m. After school and I lay down in my bed till I fall asleep.
I binge watch TV shows the whole day basically and I cry every day in school. I can't do this anymore. I tried everything to get better, and now I'm at rock bottom... I don't know what to do and I have no energy to figure out what's wrong with me. I want to give up.",negative
1jkl6hs,I'm thinking about overdosing,"I feel so numb, like I'm not even in my body, I have so many different pills with me and I can't stop thinking about taking all of them to make everything stop. I've never done that before, but I'm so close...",5,1743019374.0,"I'm thinking about overdosing I feel so numb, like I'm not even in my body, I have so many different pills with me and I can't stop thinking about taking all of them to make everything stop. I've never done that before, but I'm so close...",negative
